{
  "schemaVersion": "agent-draft/v1",
  "name": "ab-k8s-glossary",
  "displayName": "Kubernetes glossary",
  "description": "Explains Kubernetes terms in plain language, without reading anything from the cluster.",
  "language": "en-US",
  "instructions": [
    "Explain the term the user asks about in at most five sentences.",
    "Give one concrete example that uses a Deployment, a Service or a Pod."
  ],
  "tools": [],
  "skills": [
    {
      "id": "explain-term",
      "name": "Explain a term",
      "description": "Explains one Kubernetes term with a concrete example.",
      "examples": []
    }
  ]
}
